{
  "schema_version": "collage-analysis-v1",
  "reference_size": [
    900,
    1599
  ],
  "objects": [
    {
      "id": "background_1",
      "kind": "background",
      "bbox": [
        0,
        0,
        900,
        1599
      ],
      "description": "黄色底色，上面均匀分布着深褐色的圆点图案。",
      "label": "黄色底色，上面均匀分布着深褐色的圆点图案。",
      "method": "local",
      "background_type": "simple_design",
      "style": {
        "fill": "#FCE87A"
      }
    },
    {
      "id": "photo_1",
      "kind": "photo",
      "bbox": [
        86,
        26,
        795,
        499
      ],
      "description": "第一张矩形照片，展示了一盘咖喱饭（熊造型）和旁边的餐具、玩偶。画面清晰，边缘整齐。",
      "label": "第一张矩形照片，展示了一盘咖喱饭（熊造型）和旁边的餐具、玩偶",
      "method": "local",
      "rotation": 0
    },
    {
      "id": "photo_2",
      "kind": "photo",
      "bbox": [
        86,
        540,
        795,
        1014
      ],
      "description": "第二张矩形照片，展示了另一款熊造型的蛋包饭或咖喱饭，旁边有饮料和玩偶。",
      "label": "第二张矩形照片，展示了另一款熊造型的蛋包饭或咖喱饭，旁边有饮",
      "method": "local",
      "rotation": 0
    },
    {
      "id": "photo_3",
      "kind": "photo",
      "bbox": [
        94,
        1055,
        795,
        1551
      ],
      "description": "第三张矩形照片，展示了一个玻璃杯甜点（提拉米苏风格），上面放着一颗红苹果，周围有毛绒玩具。",
      "label": "第三张矩形照片，展示了一个玻璃杯甜点（提拉米苏风格），上面放",
      "method": "local",
      "rotation": 0
    },
    {
      "id": "overlay_1",
      "kind": "overlay",
      "bbox": [
        32,
        42,
        198,
        168
      ],
      "description": "左上角的一个布丁贴纸，带有焦糖色顶部和白色身体。",
      "label": "左上角的一个布丁贴纸，带有焦糖色顶部和白色身体。",
      "method": "extract"
    },
    {
      "id": "overlay_2",
      "kind": "overlay",
      "bbox": [
        720,
        56,
        855,
        208
      ],
      "description": "右上角的一片吐司面包贴纸，烤成金黄色，中间有简单的熊脸表情。",
      "label": "右上角的一片吐司面包贴纸，烤成金黄色，中间有简单的熊脸表情。",
      "method": "extract"
    },
    {
      "id": "overlay_3",
      "kind": "overlay",
      "bbox": [
        14,
        696,
        248,
        823
      ],
      "description": "左侧中部的“MUA~”艺术字贴纸，棕色字体带黄色描边，周围有星星装饰。",
      "label": "左侧中部的“MUA~”艺术字贴纸，棕色字体带黄色描边，周围有",
      "method": "extract"
    },
    {
      "id": "overlay_4",
      "kind": "overlay",
      "bbox": [
        531,
        879,
        796,
        999
      ],
      "description": "右侧中部的日文片假名“ボーナズ”贴纸，黄色字体带棕色描边，周围有放射状线条装饰。",
      "label": "右侧中部的日文片假名“ボーナズ”贴纸，黄色字体带棕色描边，周",
      "method": "extract"
    },
    {
      "id": "overlay_5",
      "kind": "overlay",
      "bbox": [
        32,
        1039,
        135,
        1151
      ],
      "description": "左下角的一个愤怒符号贴纸，由几条短粗线组成，表示生气的漫画效果。",
      "label": "左下角的一个愤怒符号贴纸，由几条短粗线组成，表示生气的漫画效",
      "method": "extract"
    },
    {
      "id": "overlay_6",
      "kind": "overlay",
      "bbox": [
        706,
        1375,
        896,
        1591
      ],
      "description": "右下角的一个熊头形状的面包或饼干贴纸，表面有网格纹理。",
      "label": "右下角的一个熊头形状的面包或饼干贴纸，表面有网格纹理。",
      "method": "extract"
    }
  ],
  "layer_order": [
    "background_1",
    "photo_1",
    "photo_2",
    "photo_3",
    "overlay_1",
    "overlay_2",
    "overlay_3",
    "overlay_4",
    "overlay_5",
    "overlay_6"
  ]
}
