{
  "schema_version": "collage-analysis-v1",
  "reference_size": [
    1080,
    1477
  ],
  "objects": [
    {
      "id": "background_1",
      "kind": "background",
      "bbox": [
        0,
        0,
        1080,
        1477
      ],
      "description": "黑色底色，上面放置着一张带有活页孔的白色纸张底板。",
      "label": "黑色底色，上面放置着一张带有活页孔的白色纸张底板。",
      "method": "extract",
      "background_type": "reference_clean"
    },
    {
      "id": "frame_1",
      "kind": "frame",
      "bbox": [
        221,
        160,
        809,
        588
      ],
      "description": "承载照片的黄色矩形相框，顶部有棕色手写体文字“#chill”，底部有深棕色文字“Find sweetness in plain days”。",
      "photo_id": "photo_1",
      "label": "承载照片的黄色矩形相框，顶部有棕色手写体文字“#chill”",
      "method": "extract"
    },
    {
      "id": "photo_1",
      "kind": "photo",
      "bbox": [
        281,
        199,
        756,
        510
      ],
      "description": "戴黑色帽子的年轻女子坐在绿色马赛克瓷砖墙前的照片。",
      "label": "戴黑色帽子的年轻女子坐在绿色马赛克瓷砖墙前的照片。",
      "method": "local",
      "rotation": 0
    },
    {
      "id": "overlay_1",
      "kind": "overlay",
      "bbox": [
        167,
        411,
        308,
        524
      ],
      "description": "三片柠檬切片的贴纸装饰。",
      "label": "三片柠檬切片的贴纸装饰。",
      "method": "extract"
    },
    {
      "id": "overlay_2",
      "kind": "overlay",
      "bbox": [
        756,
        236,
        961,
        399
      ],
      "description": "咖啡杯图案的方形贴纸，背景为棕色波点。",
      "label": "咖啡杯图案的方形贴纸，背景为棕色波点。",
      "method": "extract"
    },
    {
      "id": "text_1",
      "kind": "text",
      "bbox": [
        826,
        436,
        950,
        554
      ],
      "description": "The best\ntime is\non the\nroad.",
      "label": "The best\ntime is\non the\nroad.",
      "method": "local",
      "text": "The best\ntime is\non the\nroad.",
      "text_status": "known",
      "style": {
        "fill": "#000000",
        "font": "hand",
        "align": "left",
        "bold": false,
        "italic": false
      }
    },
    {
      "id": "overlay_3",
      "kind": "overlay",
      "bbox": [
        729,
        569,
        972,
        805
      ],
      "description": "粉色五角星贴纸，上方叠加蓝色花体字“Lemon Tang”。",
      "label": "粉色五角星贴纸，上方叠加蓝色花体字“Lemon Tang”。",
      "method": "extract"
    },
    {
      "id": "overlay_4",
      "kind": "overlay",
      "bbox": [
        200,
        583,
        340,
        702
      ],
      "description": "红白波点胶带贴纸。",
      "label": "红白波点胶带贴纸。",
      "method": "extract"
    },
    {
      "id": "photo_2",
      "kind": "photo",
      "bbox": [
        238,
        613,
        632,
        908
      ],
      "description": "戴白色帽子、穿军绿色上衣的女子站在蓝色门前的照片。",
      "label": "戴白色帽子、穿军绿色上衣的女子站在蓝色门前的照片。",
      "method": "local",
      "rotation": 0
    },
    {
      "id": "overlay_5",
      "kind": "overlay",
      "bbox": [
        502,
        849,
        578,
        894
      ],
      "description": "写有“I'M”的黄色便签纸。",
      "label": "写有“I'M”的黄色便签纸。",
      "method": "extract"
    },
    {
      "id": "overlay_6",
      "kind": "overlay",
      "bbox": [
        556,
        879,
        691,
        923
      ],
      "description": "写有“SO HAPPY”的黄色便签纸。",
      "label": "写有“SO HAPPY”的黄色便签纸。",
      "method": "extract"
    },
    {
      "id": "overlay_7",
      "kind": "overlay",
      "bbox": [
        621,
        938,
        724,
        982
      ],
      "description": "写有“TODAY”的黄色便签纸。",
      "label": "写有“TODAY”的黄色便签纸。",
      "method": "extract"
    },
    {
      "id": "text_2",
      "kind": "text",
      "bbox": [
        281,
        938,
        567,
        997
      ],
      "description": "The world is too big\nto stay in one place.",
      "label": "The world is too big\nto stay i",
      "method": "local",
      "text": "The world is too big\nto stay in one place.",
      "text_status": "known",
      "style": {
        "fill": "#000000",
        "font": "hand",
        "align": "left",
        "bold": false,
        "italic": false
      }
    },
    {
      "id": "overlay_8",
      "kind": "overlay",
      "bbox": [
        194,
        960,
        313,
        1123
      ],
      "description": "冰淇淋甜筒贴纸，背景为紫色波点。",
      "label": "冰淇淋甜筒贴纸，背景为紫色波点。",
      "method": "extract"
    },
    {
      "id": "photo_3",
      "kind": "photo",
      "bbox": [
        248,
        1041,
        545,
        1337
      ],
      "description": "穿灰色无袖上衣的女子在绿色电话亭旁的照片。",
      "label": "穿灰色无袖上衣的女子在绿色电话亭旁的照片。",
      "method": "local",
      "rotation": 0
    },
    {
      "id": "overlay_9",
      "kind": "overlay",
      "bbox": [
        578,
        1019,
        745,
        1123
      ],
      "description": "蓝色三角旗贴纸，上有红色文字“like”。",
      "label": "蓝色三角旗贴纸，上有红色文字“like”。",
      "method": "extract"
    },
    {
      "id": "photo_4",
      "kind": "photo",
      "bbox": [
        497,
        694,
        1042,
        1477
      ],
      "description": "抠图人物：戴黑色帽子、穿黑色背心和阔腿裤的女子，周围有粗白色描边。",
      "label": "抠图人物：戴黑色帽子、穿黑色背心和阔腿裤的女子，周围有粗白色",
      "method": "local",
      "rotation": 0
    }
  ],
  "layer_order": [
    "background_1",
    "frame_1",
    "photo_1",
    "overlay_1",
    "overlay_2",
    "text_1",
    "overlay_3",
    "overlay_4",
    "photo_2",
    "overlay_5",
    "overlay_6",
    "overlay_7",
    "text_2",
    "overlay_8",
    "photo_3",
    "overlay_9",
    "photo_4"
  ]
}
