{
  "schema_version": "collage-analysis-v1",
  "reference_size": [
    900,
    1200
  ],
  "objects": [
    {
      "id": "photo_background",
      "kind": "photo",
      "bbox": [
        0,
        0,
        900,
        1200
      ],
      "description": "铺满画面的俯拍照片，深灰色石砖路面占据全图，下方可见一双黑色亮面系带鞋、白袜及部分腿部。保留完整摄影环境与原有明暗，中央叠放九张照片，上方覆盖白色手绘字样和装饰。",
      "label": "铺满画面的俯拍照片，深灰色石砖路面占据全图，下方可见一双黑色",
      "method": "local",
      "rotation": 0
    },
    {
      "id": "photo_portrait_top",
      "kind": "photo",
      "bbox": [
        407,
        233,
        551,
        376
      ],
      "description": "室内女性近景照片，长发女子佩戴浅色发夹、穿浅色针织衣，面向镜头，身后可见座椅和室内陈设。保留摄影背景，矩形显示区域边缘清晰，与相邻照片留有深色间隙。",
      "label": "室内女性近景照片，长发女子佩戴浅色发夹、穿浅色针织衣，面向镜",
      "method": "local",
      "rotation": 34
    },
    {
      "id": "photo_orange_cat",
      "kind": "photo",
      "bbox": [
        533,
        315,
        679,
        459
      ],
      "description": "一只橘猫坐在室外石台上，身体侧向、头部转向镜头，身后有树木及建筑。保留完整摄影环境，照片边缘清晰，无主体出框。",
      "label": "一只橘猫坐在室外石台上，身体侧向、头部转向镜头，身后有树木及",
      "method": "local",
      "rotation": 34
    },
    {
      "id": "photo_ice_cream",
      "kind": "photo",
      "bbox": [
        659,
        402,
        801,
        549
      ],
      "description": "俯拍户外照片，两只手分别举着浅黄色和浅褐色冰淇淋，背景为受阳光照射并带树影的路面。手臂在照片边缘截断，保留摄影背景。",
      "label": "俯拍户外照片，两只手分别举着浅黄色和浅褐色冰淇淋，背景为受阳",
      "method": "local",
      "rotation": 34
    },
    {
      "id": "photo_white_cat",
      "kind": "photo",
      "bbox": [
        322,
        361,
        465,
        505
      ],
      "description": "一只白底杂色猫站在粉色床铺上，身体朝前、头转向画面右侧，背后可见室内暗部。保留床铺和室内摄影环境，主体完全位于照片窗口内。",
      "label": "一只白底杂色猫站在粉色床铺上，身体朝前、头转向画面右侧，背后",
      "method": "local",
      "rotation": 34
    },
    {
      "id": "photo_hands",
      "kind": "photo",
      "bbox": [
        448,
        445,
        594,
        588
      ],
      "description": "阳光下伸出的两只手在画面下部交叠，手腕可见配饰，背景为大面积深灰色路面及斜向亮部。保留摄影背景，手臂由照片下边缘进入，无出框显示。",
      "label": "阳光下伸出的两只手在画面下部交叠，手腕可见配饰，背景为大面积",
      "method": "local",
      "rotation": 34
    },
    {
      "id": "photo_portrait_right",
      "kind": "photo",
      "bbox": [
        574,
        531,
        719,
        675
      ],
      "description": "室内长发女子半身近景，佩戴浅色发夹，手持粉色相机靠近脸部并望向镜头，身后有木色家具和浅色墙面。保留室内摄影背景，窗口边缘清晰。",
      "label": "室内长发女子半身近景，佩戴浅色发夹，手持粉色相机靠近脸部并望",
      "method": "local",
      "rotation": 34
    },
    {
      "id": "photo_table_drinks",
      "kind": "photo",
      "bbox": [
        238,
        488,
        381,
        633
      ],
      "description": "俯拍深色木桌，桌上有蓝色及粉色饮品、甜点餐盘和小型桌面物件，斜射阳光形成明暗变化。保留桌面和周围摄影内容，整体按矩形窗口显示。",
      "label": "俯拍深色木桌，桌上有蓝色及粉色饮品、甜点餐盘和小型桌面物件，",
      "method": "local",
      "rotation": 34
    },
    {
      "id": "photo_meal",
      "kind": "photo",
      "bbox": [
        367,
        574,
        511,
        719
      ],
      "description": "俯拍木质餐桌上的多份餐食，包含饭碗、小盘、饮料杯和餐具，画面被餐桌铺满。保留所有摄影环境与餐食，窗口边缘清晰。",
      "label": "俯拍木质餐桌上的多份餐食，包含饭碗、小盘、饮料杯和餐具，画面",
      "method": "local",
      "rotation": 34
    },
    {
      "id": "photo_feet",
      "kind": "photo",
      "bbox": [
        488,
        663,
        635,
        806
      ],
      "description": "向下拍摄的腿脚照片，浅色衣物和深色鞋位于画面下部，前方为带斑驳光影的浅色地面。保留地面背景，腿部由窗口边缘截断，不延伸至窗口外。",
      "label": "向下拍摄的腿脚照片，浅色衣物和深色鞋位于画面下部，前方为带斑",
      "method": "local",
      "rotation": 34
    },
    {
      "id": "overlay_poem_left",
      "kind": "overlay",
      "bbox": [
        65,
        151,
        393,
        494
      ],
      "description": "左上白色粉笔手写英文组合，分四行写有“In Summer,”、“The wind is”、“Swaying the green”、“Shadow”。各行字号、字形和位置不规则，整体保留细瘦手写笔画；第三行末尾压在中央照片边缘上。",
      "label": "左上白色粉笔手写英文组合，分四行写有“In Summer,”",
      "method": "extract"
    },
    {
      "id": "overlay_paper_plane",
      "kind": "overlay",
      "bbox": [
        602,
        113,
        831,
        336
      ],
      "description": "右上白色粉笔手绘装饰，由纸飞机、上方两颗星形及两侧弯曲飞行线组成。保留全部不规则线条、粉笔颗粒和成员间空隙。",
      "label": "右上白色粉笔手绘装饰，由纸飞机、上方两颗星形及两侧弯曲飞行线",
      "method": "extract"
    },
    {
      "id": "overlay_bonjour",
      "kind": "overlay",
      "bbox": [
        65,
        716,
        356,
        869
      ],
      "description": "左下倾斜的白色粉笔“Bonjour”字样与猫脸涂鸦、两侧短划线组成完整装饰，保留粗糙笔触和各成员的位置关系。",
      "label": "左下倾斜的白色粉笔“Bonjour”字样与猫脸涂鸦、两侧短划",
      "method": "extract"
    },
    {
      "id": "overlay_poem_right",
      "kind": "overlay",
      "bbox": [
        547,
        692,
        861,
        1106
      ],
      "description": "右下白色手写诗句组合，依次为“We are like”、“Summer”、“young and beautiful”、“Smiling”、“as bright a”、“Clear Sky”，下方附一颗细线小星。字形、大小和行位置各异，整体保留；顶部字样覆盖右下照片边缘。",
      "label": "右下白色手写诗句组合，依次为“We are like”、“S",
      "method": "extract"
    }
  ],
  "layer_order": [
    "photo_background",
    "photo_portrait_top",
    "photo_orange_cat",
    "photo_ice_cream",
    "photo_white_cat",
    "photo_hands",
    "photo_portrait_right",
    "photo_table_drinks",
    "photo_meal",
    "photo_feet",
    "overlay_poem_left",
    "overlay_paper_plane",
    "overlay_bonjour",
    "overlay_poem_right"
  ]
}
