{
  "schema_version": "collage-analysis-v1",
  "reference_size": [
    900,
    1198
  ],
  "objects": [
    {
      "id": "background",
      "kind": "background",
      "bbox": [
        0,
        0,
        900,
        1198
      ],
      "description": "白色与浅青色交融的固定纸质底纹，保留淡灰星形虚影、细小斑点、柔和光晕及朦胧褶皱，不包含独立纸框、标签与前景装饰。",
      "label": "白色与浅青色交融的固定纸质底纹，保留淡灰星形虚影、细小斑点、",
      "method": "extract",
      "background_type": "reference_clean"
    },
    {
      "id": "main_photo",
      "kind": "photo",
      "bbox": [
        50,
        205,
        502,
        883
      ],
      "description": "一名黑色长发女子蹲坐在路边，穿浅色条纹长衬衫、白色上衣及深色鞋，双臂环抱膝部，脸朝画面右上方。背景为茂密绿叶、石阶和带黄色标线的地面，摄影环境完整保留；照片按纸框内口显示，无主体出框。右上部分被花卉照片框遮挡，右下被文字标签局部遮挡。",
      "label": "一名黑色长发女子蹲坐在路边，穿浅色条纹长衬衫、白色上衣及深色",
      "method": "local",
      "rotation": 0
    },
    {
      "id": "main_frame",
      "kind": "frame",
      "bbox": [
        16,
        155,
        595,
        916
      ],
      "description": "承载主照片的宽边白色纸框，四周具有不规则撕纸边缘、轻微纸张起伏和柔灰阴影，右侧宽白边向下延伸。保留完整纸质载体，内口摄影内容单独替换。",
      "photo_id": "main_photo",
      "label": "承载主照片的宽边白色纸框，四周具有不规则撕纸边缘、轻微纸张起",
      "method": "extract"
    },
    {
      "id": "metal_clip",
      "kind": "overlay",
      "bbox": [
        254,
        146,
        354,
        224
      ],
      "description": "主照片上沿中央的银灰色金属夹，包含圆形铆钉、竖向夹柄、横向夹口、金属高光与投影，整体压在纸框和照片上方。",
      "label": "主照片上沿中央的银灰色金属夹，包含圆形铆钉、竖向夹柄、横向夹",
      "method": "extract"
    },
    {
      "id": "flower_photo",
      "kind": "photo",
      "bbox": [
        425,
        398,
        670,
        553
      ],
      "description": "近景白色小花与细枝绿叶，后方可见较暗的横向构件和植物环境，无人物。摄影背景保留，画面显示于横向小相框内口，右上角呈斜切显示边界，四周被固定框沿包围。",
      "label": "近景白色小花与细枝绿叶，后方可见较暗的横向构件和植物环境，无",
      "method": "local",
      "rotation": 0
    },
    {
      "id": "flower_frame",
      "kind": "frame",
      "bbox": [
        386,
        363,
        704,
        583
      ],
      "description": "横向浅银白色立体相框，保留宽框沿、内侧白色斜面、外缘细密珠点纹理及柔和阴影，覆盖主照片右上部，内口花卉摄影内容独立替换。",
      "photo_id": "flower_photo",
      "label": "横向浅银白色立体相框，保留宽框沿、内侧白色斜面、外缘细密珠点",
      "method": "extract"
    },
    {
      "id": "summer_label",
      "kind": "overlay",
      "bbox": [
        704,
        286,
        847,
        391
      ],
      "description": "白色对话气泡标签，带浅灰细边与下方偏左的尖角，内部为“♪ summer ♫”字样；文字、音符、底板和微弱阴影作为完整装饰保留。",
      "label": "白色对话气泡标签，带浅灰细边与下方偏左的尖角，内部为“♪ s",
      "method": "extract"
    },
    {
      "id": "caption_label",
      "kind": "overlay",
      "bbox": [
        391,
        794,
        810,
        976
      ],
      "description": "白色横向圆角留言标签，保留双层浅灰细边及阴影。内部两行日文为“駆け抜けた恋、戻らない夏、”“綺麗な花火だった。”，右下有两个空心爱心；全部随标签整体保留，压住主照片右下与纸框。",
      "label": "白色横向圆角留言标签，保留双层浅灰细边及阴影。内部两行日文为",
      "method": "extract"
    },
    {
      "id": "wings",
      "kind": "overlay",
      "bbox": [
        652,
        641,
        900,
        758
      ],
      "description": "右侧成对的白色小翅膀装饰，包含弯曲羽片轮廓、浅灰描边与柔和阴影，左翼带小星点，右翼部分超出画布，整体保留。",
      "label": "右侧成对的白色小翅膀装饰，包含弯曲羽片轮廓、浅灰描边与柔和阴",
      "method": "extract"
    },
    {
      "id": "large_outline_star",
      "kind": "overlay",
      "bbox": [
        704,
        0,
        894,
        188
      ],
      "description": "右上角大型空心五角星，保留浅灰细线轮廓及轻微柔化边缘，顶尖触及画布上边。",
      "label": "右上角大型空心五角星，保留浅灰细线轮廓及轻微柔化边缘，顶尖触",
      "method": "extract"
    },
    {
      "id": "small_outline_star",
      "kind": "overlay",
      "bbox": [
        637,
        216,
        698,
        272
      ],
      "description": "位于主纸框右上外侧的小型空心五角星，保留灰色细线与轻微暖色边缘。",
      "label": "位于主纸框右上外侧的小型空心五角星，保留灰色细线与轻微暖色边",
      "method": "extract"
    },
    {
      "id": "right_edge_star",
      "kind": "overlay",
      "bbox": [
        866,
        491,
        900,
        556
      ],
      "description": "右侧画布边缘露出的空心星形装饰，仅保留可见灰色轮廓，右部被画布裁切。",
      "label": "右侧画布边缘露出的空心星形装饰，仅保留可见灰色轮廓，右部被画",
      "method": "extract"
    },
    {
      "id": "left_edge_star",
      "kind": "overlay",
      "bbox": [
        0,
        939,
        32,
        1002
      ],
      "description": "左侧画布边缘露出的空心星形装饰，细灰线轮廓向画布外延伸，仅保留可见部分。",
      "label": "左侧画布边缘露出的空心星形装饰，细灰线轮廓向画布外延伸，仅保",
      "method": "extract"
    },
    {
      "id": "bottom_star_cluster",
      "kind": "overlay",
      "bbox": [
        44,
        877,
        392,
        1157
      ],
      "description": "左下方散落的银灰色星星装饰群，包含大小不一的实心五角星、浅白星形、细小星点及各自柔和阴影；从主纸框下沿附近延伸至画布底部，各成员共同构成这一局部散星设计。",
      "label": "左下方散落的银灰色星星装饰群，包含大小不一的实心五角星、浅白",
      "method": "extract"
    }
  ],
  "layer_order": [
    "background",
    "large_outline_star",
    "small_outline_star",
    "right_edge_star",
    "left_edge_star",
    "wings",
    "main_frame",
    "main_photo",
    "metal_clip",
    "flower_photo",
    "flower_frame",
    "summer_label",
    "bottom_star_cluster",
    "caption_label"
  ]
}
